No.,Time,Source,Destination,Protocol,Length,Info
1,0,162.159.136.234,192.168.59.232,TLSv1.2,265,Application Data
2,0.053407,192.168.59.232,162.159.136.234,TCP,54,2247  >  443 [ACK] Seq=1 Ack=212 Win=3575 Len=0
3,0.058065,162.159.136.234,192.168.59.232,TCP,265,"[TCP Spurious Retransmission] 443  >  2247 [PSH, ACK] Seq=1 Ack=1 Win=8 Len=211"
4,0.058094,192.168.59.232,162.159.136.234,TCP,66,[TCP Dup ACK 2#1] 2247  >  443 [ACK] Seq=1 Ack=212 Win=3575 Len=0 SLE=1 SRE=212
5,0.058166,162.159.136.234,192.168.59.232,TLSv1.2,331,Application Data
6,0.101373,192.168.59.232,162.159.136.234,TCP,54,2247  >  443 [ACK] Seq=1 Ack=489 Win=3574 Len=0
7,0.641599,192.168.59.232,192.168.59.222,DNS,89,Standard query 0xe76f A v10.events.data.microsoft.com
8,0.644134,192.168.59.232,192.168.59.222,DNS,89,Standard query 0x0f33 AAAA v10.events.data.microsoft.com
9,0.894603,162.159.136.234,192.168.59.232,TLSv1.2,406,Application Data
10,0.900565,192.168.59.222,192.168.59.232,DNS,216,Standard query response 0xe76f A v10.events.data.microsoft.com CNAME global.asimov.events.data.trafficmanager.net CNAME onedscolprdeus06.eastus.cloudapp.azure.com A 20.42.73.25
11,0.910412,192.168.59.222,192.168.59.232,DNS,261,Standard query response 0x0f33 AAAA v10.events.data.microsoft.com CNAME global.asimov.events.data.trafficmanager.net CNAME onedscolprduks04.uksouth.cloudapp.azure.com SOA ns1-01.azure-dns.com
12,0.911255,192.168.59.232,20.42.73.25,TCP,66,1050  >  443 [SYN] Seq=0 Win=64240 Len=0 MSS=1460 WS=256 SACK_PERM=1
13,0.937165,192.168.59.232,162.159.136.234,TCP,54,2247  >  443 [ACK] Seq=1 Ack=841 Win=3573 Len=0
14,1.161229,20.42.73.25,192.168.59.232,TCP,66,"443  >  1050 [SYN, ACK] Seq=0 Ack=1 Win=65535 Len=0 MSS=1400 WS=256 SACK_PERM=1"
15,1.161485,192.168.59.232,20.42.73.25,TCP,54,1050  >  443 [ACK] Seq=1 Ack=1 Win=65792 Len=0
16,1.162031,192.168.59.232,20.42.73.25,TLSv1.2,268,Client Hello
17,1.348451,192.168.59.232,23.207.140.125,TCP,54,"2262  >  443 [FIN, ACK] Seq=1 Ack=1 Win=257 Len=0"
18,1.432998,23.207.140.125,192.168.59.232,TLSv1.2,85,Encrypted Alert
19,1.432998,23.207.140.125,192.168.59.232,TCP,54,"443  >  2262 [FIN, ACK] Seq=32 Ack=2 Win=501 Len=0"
20,1.433118,192.168.59.232,23.207.140.125,TCP,54,"2262  >  443 [RST, ACK] Seq=2 Ack=32 Win=0 Len=0"
21,1.472224,162.159.136.234,192.168.59.232,TLSv1.2,181,Application Data
22,1.506909,162.159.136.234,192.168.59.232,TLSv1.2,292,Application Data
23,1.507014,192.168.59.232,162.159.136.234,TCP,54,2247  >  443 [ACK] Seq=1 Ack=1206 Win=3571 Len=0
24,1.615147,20.42.73.25,192.168.59.232,TCP,1454,443  >  1050 [ACK] Seq=1 Ack=215 Win=524544 Len=1400 [TCP segment of a reassembled PDU]
25,1.616349,20.42.73.25,192.168.59.232,TCP,1454,443  >  1050 [ACK] Seq=1401 Ack=215 Win=524544 Len=1400 [TCP segment of a reassembled PDU]
26,1.616445,192.168.59.232,20.42.73.25,TCP,54,1050  >  443 [ACK] Seq=215 Ack=2801 Win=65792 Len=0
27,1.616658,20.42.73.25,192.168.59.232,TCP,1454,443  >  1050 [ACK] Seq=2801 Ack=215 Win=524544 Len=1400 [TCP segment of a reassembled PDU]
28,1.617193,20.42.73.25,192.168.59.232,TLSv1.2,256,"Server Hello, Certificate, Server Key Exchange, Server Hello Done"
29,1.61727,192.168.59.232,20.42.73.25,TCP,54,1050  >  443 [ACK] Seq=215 Ack=4403 Win=65792 Len=0
30,1.621869,192.168.59.232,20.42.73.25,TLSv1.2,212,"Client Key Exchange, Change Cipher Spec, Encrypted Handshake Message"
31,1.709545,162.159.136.234,192.168.59.232,TLSv1.2,485,Application Data
32,1.760073,192.168.59.232,162.159.136.234,TCP,54,2247  >  443 [ACK] Seq=1 Ack=1637 Win=3576 Len=0
33,1.861257,20.42.73.25,192.168.59.232,TLSv1.2,105,"Change Cipher Spec, Encrypted Handshake Message"
34,1.86408,192.168.59.232,20.42.73.25,TLSv1.2,1024,Application Data
35,1.864358,192.168.59.232,20.42.73.25,TLSv1.2,1345,Application Data
36,2.127173,20.42.73.25,192.168.59.232,TCP,54,443  >  1050 [ACK] Seq=4454 Ack=2634 Win=524800 Len=0
37,2.127343,20.42.73.25,192.168.59.232,TLSv1.2,507,Application Data
38,2.132443,192.168.59.232,20.42.73.25,TCP,1454,1050  >  443 [ACK] Seq=2634 Ack=4907 Win=65280 Len=1400 [TCP segment of a reassembled PDU]
39,2.132443,192.168.59.232,20.42.73.25,TLSv1.2,110,Application Data
40,2.132937,192.168.59.232,20.42.73.25,TLSv1.2,1001,Application Data
41,2.235571,fe80::6836:deff:fe8e:4dda,2401:4900:5607:5efe:85e2:a0ed:cd6:d7c0,ICMPv6,86,Neighbor Solicitation for 2401:4900:5607:5efe:85e2:a0ed:cd6:d7c0 from 6a:36:de:8e:4d:da
42,2.235646,2401:4900:5607:5efe:85e2:a0ed:cd6:d7c0,fe80::6836:deff:fe8e:4dda,ICMPv6,86,"Neighbor Advertisement 2401:4900:5607:5efe:85e2:a0ed:cd6:d7c0 (sol, ovr) is at 40:5b:d8:01:09:6b"
43,2.379891,162.159.136.234,192.168.59.232,TLSv1.2,274,Application Data
44,2.379891,20.42.73.25,192.168.59.232,TCP,54,443  >  1050 [ACK] Seq=4907 Ack=4090 Win=524800 Len=0
45,2.379891,20.42.73.25,192.168.59.232,TLSv1.2,505,Application Data
46,2.385996,192.168.59.232,20.42.73.25,TCP,1454,1050  >  443 [ACK] Seq=5037 Ack=5358 Win=64768 Len=1400 [TCP segment of a reassembled PDU]
47,2.385996,192.168.59.232,20.42.73.25,TLSv1.2,185,Application Data
48,2.386307,192.168.59.232,20.42.73.25,TLSv1.2,824,Application Data
49,2.423393,192.168.59.232,162.159.136.234,TCP,54,2247  >  443 [ACK] Seq=1 Ack=1857 Win=3575 Len=0
50,2.462703,162.159.136.234,192.168.59.232,TLSv1.2,99,Application Data
51,2.503267,192.168.59.232,162.159.136.234,TCP,54,2247  >  443 [ACK] Seq=1 Ack=1902 Win=3575 Len=0
52,2.620807,192.168.59.232,20.42.73.27,TCP,54,"1033  >  443 [FIN, ACK] Seq=1 Ack=1 Win=256 Len=0"
53,2.621064,192.168.59.232,52.114.15.135,TCP,54,"1042  >  443 [FIN, ACK] Seq=1 Ack=1 Win=256 Len=0"
54,2.621687,192.168.59.232,192.168.59.222,DNS,79,Standard query 0x7268 A teams.microsoft.com
55,2.621949,192.168.59.232,192.168.59.222,DNS,79,Standard query 0x4748 AAAA teams.microsoft.com
56,2.632172,20.42.73.25,192.168.59.232,TCP,54,443  >  1050 [ACK] Seq=5358 Ack=6568 Win=524800 Len=0
57,2.637512,20.42.73.25,192.168.59.232,TLSv1.2,505,Application Data
58,2.644241,192.168.59.232,20.42.73.25,TCP,1454,1050  >  443 [ACK] Seq=7338 Ack=5809 Win=65792 Len=1400 [TCP segment of a reassembled PDU]
59,2.644241,192.168.59.232,20.42.73.25,TLSv1.2,111,Application Data
60,2.644704,192.168.59.232,20.42.73.25,TCP,1454,1050  >  443 [ACK] Seq=8795 Ack=5809 Win=65792 Len=1400 [TCP segment of a reassembled PDU]
61,2.644704,192.168.59.232,20.42.73.25,TLSv1.2,494,Application Data
62,2.839249,192.168.59.222,192.168.59.232,DNS,255,Standard query response 0x7268 A teams.microsoft.com CNAME teams.office.com CNAME teams-mira-afd.trafficmanager.net CNAME teams-office-com.s-0005.s-msedge.net CNAME s-0005.s-msedge.net A 52.113.194.132
63,2.839465,192.168.59.222,192.168.59.232,DNS,267,Standard query response 0x4748 AAAA teams.microsoft.com CNAME teams.office.com CNAME teams-mira-afd.trafficmanager.net CNAME teams-office-com.s-0005.s-msedge.net CNAME s-0005.s-msedge.net AAAA 2620:1ec:42::132
64,2.840422,2401:4900:5607:5efe:85e2:a0ed:cd6:d7c0,2620:1ec:42::132,TCP,86,1051  >  443 [SYN] Seq=0 Win=64800 Len=0 MSS=1440 WS=256 SACK_PERM=1
65,2.883927,2401:4900:5607:5efe:85e2:a0ed:cd6:d7c0,2620:1ec:42::132,TCP,86,1055  >  443 [SYN] Seq=0 Win=64800 Len=0 MSS=1440 WS=256 SACK_PERM=1
66,2.89939,20.42.73.25,192.168.59.232,TCP,66,[TCP Dup ACK 57#1] 443  >  1050 [ACK] Seq=5809 Ack=7338 Win=524032 Len=0 SLE=8738 SRE=8795
67,2.89939,20.42.73.25,192.168.59.232,TCP,54,443  >  1050 [ACK] Seq=5809 Ack=8795 Win=524800 Len=0
68,2.905243,52.114.15.135,192.168.59.232,TCP,54,"443  >  1042 [RST, ACK] Seq=1 Ack=2 Win=0 Len=0"
69,2.907613,20.42.73.25,192.168.59.232,TCP,54,443  >  1050 [ACK] Seq=5809 Ack=10635 Win=524800 Len=0
70,2.908926,20.42.73.25,192.168.59.232,TLSv1.2,505,Application Data
71,2.912624,192.168.59.232,20.42.73.25,TCP,1454,1050  >  443 [ACK] Seq=10635 Ack=6260 Win=65280 Len=1400 [TCP segment of a reassembled PDU]
72,2.912624,192.168.59.232,20.42.73.25,TLSv1.2,111,Application Data
73,2.913029,192.168.59.232,20.42.73.25,TCP,1454,1050  >  443 [ACK] Seq=12092 Ack=6260 Win=65280 Len=1400 [TCP segment of a reassembled PDU]
74,2.913029,192.168.59.232,20.42.73.25,TLSv1.2,736,Application Data
75,3.04769,20.42.73.27,192.168.59.232,TCP,54,"443  >  1033 [RST, ACK] Seq=1 Ack=2 Win=0 Len=0"
76,3.097125,2620:1ec:42::132,2401:4900:5607:5efe:85e2:a0ed:cd6:d7c0,TCP,86,"443  >  1051 [SYN, ACK] Seq=0 Ack=1 Win=65535 Len=0 MSS=1400 WS=256 SACK_PERM=1"
77,3.097289,2401:4900:5607:5efe:85e2:a0ed:cd6:d7c0,2620:1ec:42::132,TCP,74,1051  >  443 [ACK] Seq=1 Ack=1 Win=64768 Len=0
78,3.097959,2401:4900:5607:5efe:85e2:a0ed:cd6:d7c0,2620:1ec:42::132,TLSv1.2,591,Client Hello
79,3.103158,2620:1ec:42::132,2401:4900:5607:5efe:85e2:a0ed:cd6:d7c0,TCP,86,"443  >  1055 [SYN, ACK] Seq=0 Ack=1 Win=65535 Len=0 MSS=1400 WS=256 SACK_PERM=1"
80,3.103247,2401:4900:5607:5efe:85e2:a0ed:cd6:d7c0,2620:1ec:42::132,TCP,74,1055  >  443 [ACK] Seq=1 Ack=1 Win=64768 Len=0
81,3.103847,2401:4900:5607:5efe:85e2:a0ed:cd6:d7c0,2620:1ec:42::132,TLSv1.2,591,Client Hello
82,3.150214,20.42.73.25,192.168.59.232,TCP,54,443  >  1050 [ACK] Seq=6260 Ack=12092 Win=524800 Len=0
83,3.157576,20.42.73.25,192.168.59.232,TCP,54,443  >  1050 [ACK] Seq=6260 Ack=14174 Win=524800 Len=0
84,3.161263,20.42.73.25,192.168.59.232,TLSv1.2,504,Application Data
85,3.167179,192.168.59.232,20.42.73.25,TCP,1454,1050  >  443 [ACK] Seq=14174 Ack=6710 Win=64768 Len=1400 [TCP segment of a reassembled PDU]
86,3.167179,192.168.59.232,20.42.73.25,TLSv1.2,110,Application Data
87,3.168193,192.168.59.232,20.42.73.25,TLSv1.2,614,Application Data
88,3.36846,2620:1ec:42::132,2401:4900:5607:5efe:85e2:a0ed:cd6:d7c0,TCP,74,443  >  1051 [ACK] Seq=1 Ack=518 Win=4193792 Len=0
89,3.36846,2620:1ec:42::132,2401:4900:5607:5efe:85e2:a0ed:cd6:d7c0,TCP,4274,443  >  1051 [ACK] Seq=1 Ack=518 Win=4193792 Len=4200 [TCP segment of a reassembled PDU]
90,3.368546,2401:4900:5607:5efe:85e2:a0ed:cd6:d7c0,2620:1ec:42::132,TCP,74,1051  >  443 [ACK] Seq=518 Ack=4201 Win=65792 Len=0
91,3.370104,2620:1ec:42::132,2401:4900:5607:5efe:85e2:a0ed:cd6:d7c0,TCP,1474,443  >  1051 [ACK] Seq=4201 Ack=518 Win=4193792 Len=1400 [TCP segment of a reassembled PDU]
92,3.370147,2401:4900:5607:5efe:85e2:a0ed:cd6:d7c0,2620:1ec:42::132,TCP,74,1051  >  443 [ACK] Seq=518 Ack=5601 Win=65792 Len=0
93,3.370312,2620:1ec:42::132,2401:4900:5607:5efe:85e2:a0ed:cd6:d7c0,TLSv1.2,385,"Server Hello, Certificate, Certificate Status, Server Key Exchange, Server Hello Done"
94,3.373003,2620:1ec:42::132,2401:4900:5607:5efe:85e2:a0ed:cd6:d7c0,TCP,74,443  >  1055 [ACK] Seq=1 Ack=518 Win=4193792 Len=0
95,3.374553,2401:4900:5607:5efe:85e2:a0ed:cd6:d7c0,2620:1ec:42::132,TLSv1.2,232,"Client Key Exchange, Change Cipher Spec, Encrypted Handshake Message"
96,3.374823,2401:4900:5607:5efe:85e2:a0ed:cd6:d7c0,2620:1ec:42::132,TLSv1.2,173,Application Data
97,3.375375,2401:4900:5607:5efe:85e2:a0ed:cd6:d7c0,2620:1ec:42::132,TCP,1474,1051  >  443 [ACK] Seq=775 Ack=5912 Win=65280 Len=1400 [TCP segment of a reassembled PDU]
98,3.375375,2401:4900:5607:5efe:85e2:a0ed:cd6:d7c0,2620:1ec:42::132,TCP,1474,1051  >  443 [ACK] Seq=2175 Ack=5912 Win=65280 Len=1400 [TCP segment of a reassembled PDU]
99,3.375375,2401:4900:5607:5efe:85e2:a0ed:cd6:d7c0,2620:1ec:42::132,TCP,1474,1051  >  443 [ACK] Seq=3575 Ack=5912 Win=65280 Len=1400 [TCP segment of a reassembled PDU]
100,3.375375,2401:4900:5607:5efe:85e2:a0ed:cd6:d7c0,2620:1ec:42::132,TLSv1.2,934,Application Data
101,3.38755,2620:1ec:42::132,2401:4900:5607:5efe:85e2:a0ed:cd6:d7c0,TCP,4274,443  >  1055 [ACK] Seq=1 Ack=518 Win=4193792 Len=4200 [TCP segment of a reassembled PDU]
102,3.38765,2401:4900:5607:5efe:85e2:a0ed:cd6:d7c0,2620:1ec:42::132,TCP,74,1055  >  443 [ACK] Seq=518 Ack=4201 Win=65792 Len=0
103,3.387796,2620:1ec:42::132,2401:4900:5607:5efe:85e2:a0ed:cd6:d7c0,TCP,1474,443  >  1055 [ACK] Seq=4201 Ack=518 Win=4193792 Len=1400 [TCP segment of a reassembled PDU]
104,3.387818,2401:4900:5607:5efe:85e2:a0ed:cd6:d7c0,2620:1ec:42::132,TCP,74,1055  >  443 [ACK] Seq=518 Ack=5601 Win=65792 Len=0
105,3.390325,2620:1ec:42::132,2401:4900:5607:5efe:85e2:a0ed:cd6:d7c0,TLSv1.2,421,"Server Hello, Certificate, Certificate Status, Server Key Exchange, Server Hello Done"
106,3.394602,2401:4900:5607:5efe:85e2:a0ed:cd6:d7c0,2620:1ec:42::132,TLSv1.2,232,"Client Key Exchange, Change Cipher Spec, Encrypted Handshake Message"
107,3.417209,20.42.73.25,192.168.59.232,TCP,54,443  >  1050 [ACK] Seq=6710 Ack=15630 Win=524800 Len=0
108,3.417209,2620:1ec:42::132,2401:4900:5607:5efe:85e2:a0ed:cd6:d7c0,TCP,74,443  >  1051 [ACK] Seq=5912 Ack=676 Win=4193536 Len=0
109,3.417209,2620:1ec:42::132,2401:4900:5607:5efe:85e2:a0ed:cd6:d7c0,TCP,74,[TCP Dup ACK 108#1] 443  >  1051 [ACK] Seq=5912 Ack=676 Win=4193536 Len=0
110,3.419,2620:1ec:42::132,2401:4900:5607:5efe:85e2:a0ed:cd6:d7c0,TLSv1.2,416,"New Session Ticket, Change Cipher Spec, Encrypted Handshake Message"
111,3.41909,2620:1ec:42::132,2401:4900:5607:5efe:85e2:a0ed:cd6:d7c0,TLSv1.2,143,Application Data
112,3.419145,2401:4900:5607:5efe:85e2:a0ed:cd6:d7c0,2620:1ec:42::132,TCP,74,1051  >  443 [ACK] Seq=5835 Ack=6323 Win=65024 Len=0
113,3.419624,2401:4900:5607:5efe:85e2:a0ed:cd6:d7c0,2620:1ec:42::132,TLSv1.2,112,Application Data
114,3.419891,20.42.73.25,192.168.59.232,TLSv1.2,505,Application Data
115,3.422882,192.168.59.232,20.42.73.25,TCP,1454,1050  >  443 [ACK] Seq=16190 Ack=7161 Win=64256 Len=1400 [TCP segment of a reassembled PDU]
116,3.422882,192.168.59.232,20.42.73.25,TLSv1.2,111,Application Data
117,3.423203,192.168.59.232,20.42.73.25,TCP,1454,1050  >  443 [ACK] Seq=17647 Ack=7161 Win=64256 Len=1400 [TCP segment of a reassembled PDU]
118,3.423203,192.168.59.232,20.42.73.25,TCP,1454,1050  >  443 [ACK] Seq=19047 Ack=7161 Win=64256 Len=1400 [TCP segment of a reassembled PDU]
119,3.423203,192.168.59.232,20.42.73.25,TCP,1454,1050  >  443 [ACK] Seq=20447 Ack=7161 Win=64256 Len=1400 [TCP segment of a reassembled PDU]
120,3.423203,192.168.59.232,20.42.73.25,TLSv1.2,1120,Application Data
121,3.425526,2620:1ec:42::132,2401:4900:5607:5efe:85e2:a0ed:cd6:d7c0,TCP,74,443  >  1051 [ACK] Seq=6323 Ack=775 Win=4193536 Len=0
122,3.4271,2620:1ec:42::132,2401:4900:5607:5efe:85e2:a0ed:cd6:d7c0,TLSv1.2,112,Application Data
123,3.431023,2620:1ec:42::132,2401:4900:5607:5efe:85e2:a0ed:cd6:d7c0,TCP,74,443  >  1051 [ACK] Seq=6361 Ack=3575 Win=4194304 Len=0
124,3.438072,2620:1ec:42::132,2401:4900:5607:5efe:85e2:a0ed:cd6:d7c0,TCP,74,443  >  1051 [ACK] Seq=6361 Ack=4975 Win=4194304 Len=0
125,3.442498,2620:1ec:42::132,2401:4900:5607:5efe:85e2:a0ed:cd6:d7c0,TCP,74,443  >  1051 [ACK] Seq=6361 Ack=5835 Win=4193536 Len=0
126,3.446697,2620:1ec:42::132,2401:4900:5607:5efe:85e2:a0ed:cd6:d7c0,TCP,74,443  >  1055 [ACK] Seq=5948 Ack=676 Win=4193536 Len=0
127,3.446697,2620:1ec:42::132,2401:4900:5607:5efe:85e2:a0ed:cd6:d7c0,TCP,74,[TCP Dup ACK 126#1] 443  >  1055 [ACK] Seq=5948 Ack=676 Win=4193536 Len=0
128,3.447256,2620:1ec:42::132,2401:4900:5607:5efe:85e2:a0ed:cd6:d7c0,TLSv1.2,416,"New Session Ticket, Change Cipher Spec, Encrypted Handshake Message"
129,3.447256,2620:1ec:42::132,2401:4900:5607:5efe:85e2:a0ed:cd6:d7c0,TLSv1.2,143,Application Data
130,3.447328,2401:4900:5607:5efe:85e2:a0ed:cd6:d7c0,2620:1ec:42::132,TCP,74,1055  >  443 [ACK] Seq=676 Ack=6359 Win=65024 Len=0
131,3.475263,162.159.136.234,192.168.59.232,TLSv1.2,98,Application Data
132,3.475263,2620:1ec:42::132,2401:4900:5607:5efe:85e2:a0ed:cd6:d7c0,TLSv1.2,527,Application Data
133,3.475263,2620:1ec:42::132,2401:4900:5607:5efe:85e2:a0ed:cd6:d7c0,TCP,74,443  >  1051 [ACK] Seq=6814 Ack=5873 Win=4193280 Len=0
134,3.475405,2401:4900:5607:5efe:85e2:a0ed:cd6:d7c0,2620:1ec:42::132,TCP,74,1051  >  443 [ACK] Seq=5873 Ack=6814 Win=64512 Len=0
135,3.518407,192.168.59.232,162.159.136.234,TCP,54,2247  >  443 [ACK] Seq=1 Ack=1946 Win=3575 Len=0
136,3.63849,162.159.136.234,192.168.59.232,TLSv1.2,188,Application Data
137,3.674259,20.42.73.25,192.168.59.232,TCP,66,[TCP Dup ACK 114#1] 443  >  1050 [ACK] Seq=7161 Ack=16190 Win=524288 Len=0 SLE=17590 SRE=17647
138,3.674259,20.42.73.25,192.168.59.232,TCP,54,443  >  1050 [ACK] Seq=7161 Ack=17647 Win=524800 Len=0
139,3.682185,192.168.59.232,162.159.136.234,TCP,54,2247  >  443 [ACK] Seq=1 Ack=2080 Win=3574 Len=0
140,3.682371,20.42.73.25,192.168.59.232,TCP,54,443  >  1050 [ACK] Seq=7161 Ack=20447 Win=524800 Len=0
141,3.690761,20.42.73.25,192.168.59.232,TCP,54,443  >  1050 [ACK] Seq=7161 Ack=22913 Win=524800 Len=0
142,3.69303,192.168.59.232,192.168.59.222,DNS,88,Standard query 0x5298 A presence.teams.microsoft.com
143,3.693303,192.168.59.232,192.168.59.222,DNS,88,Standard query 0xb980 AAAA presence.teams.microsoft.com
144,3.693409,20.42.73.25,192.168.59.232,TLSv1.2,507,Application Data
145,3.696349,192.168.59.232,20.42.73.25,TCP,54,"1050  >  443 [FIN, ACK] Seq=22913 Ack=7614 Win=65792 Len=0"
146,3.792341,192.168.59.232,192.168.59.222,DNS,110,Standard query 0x774d A trouter2-azsc-jpea-1-b.trouter.teams.microsoft.com
147,3.792655,192.168.59.232,192.168.59.222,DNS,110,Standard query 0x0f90 AAAA trouter2-azsc-jpea-1-b.trouter.teams.microsoft.com
148,3.799101,2401:4900:5607:5efe:85e2:a0ed:cd6:d7c0,2620:1ec:42::132,TCP,1474,1051  >  443 [ACK] Seq=5873 Ack=6814 Win=64512 Len=1400 [TCP segment of a reassembled PDU]
149,3.799101,2401:4900:5607:5efe:85e2:a0ed:cd6:d7c0,2620:1ec:42::132,TCP,1474,1051  >  443 [ACK] Seq=7273 Ack=6814 Win=64512 Len=1400 [TCP segment of a reassembled PDU]
150,3.799101,2401:4900:5607:5efe:85e2:a0ed:cd6:d7c0,2620:1ec:42::132,TCP,1474,1051  >  443 [ACK] Seq=8673 Ack=6814 Win=64512 Len=1400 [TCP segment of a reassembled PDU]
151,3.799101,2401:4900:5607:5efe:85e2:a0ed:cd6:d7c0,2620:1ec:42::132,TCP,1474,1051  >  443 [ACK] Seq=10073 Ack=6814 Win=64512 Len=1400 [TCP segment of a reassembled PDU]
152,3.799101,2401:4900:5607:5efe:85e2:a0ed:cd6:d7c0,2620:1ec:42::132,TCP,1474,1051  >  443 [ACK] Seq=11473 Ack=6814 Win=64512 Len=1400 [TCP segment of a reassembled PDU]
153,3.799101,2401:4900:5607:5efe:85e2:a0ed:cd6:d7c0,2620:1ec:42::132,TLSv1.2,704,Application Data
154,3.811743,2401:4900:5607:5efe:85e2:a0ed:cd6:d7c0,2620:1ec:42::132,TCP,1474,1051  >  443 [ACK] Seq=13503 Ack=6814 Win=64512 Len=1400 [TCP segment of a reassembled PDU]
155,3.811743,2401:4900:5607:5efe:85e2:a0ed:cd6:d7c0,2620:1ec:42::132,TCP,1474,1051  >  443 [ACK] Seq=14903 Ack=6814 Win=64512 Len=1400 [TCP segment of a reassembled PDU]
156,3.811743,2401:4900:5607:5efe:85e2:a0ed:cd6:d7c0,2620:1ec:42::132,TCP,1474,1051  >  443 [ACK] Seq=16303 Ack=6814 Win=64512 Len=1400 [TCP segment of a reassembled PDU]
157,3.811743,2401:4900:5607:5efe:85e2:a0ed:cd6:d7c0,2620:1ec:42::132,TCP,1474,1051  >  443 [ACK] Seq=17703 Ack=6814 Win=64512 Len=1400 [TCP segment of a reassembled PDU]
158,3.811743,2401:4900:5607:5efe:85e2:a0ed:cd6:d7c0,2620:1ec:42::132,TCP,1474,1051  >  443 [ACK] Seq=19103 Ack=6814 Win=64512 Len=1400 [TCP segment of a reassembled PDU]
159,3.811743,2401:4900:5607:5efe:85e2:a0ed:cd6:d7c0,2620:1ec:42::132,TLSv1.2,541,Application Data
160,3.870475,2620:1ec:42::132,2401:4900:5607:5efe:85e2:a0ed:cd6:d7c0,TCP,74,443  >  1051 [ACK] Seq=6814 Ack=7273 Win=4194304 Len=0
161,3.874228,2620:1ec:42::132,2401:4900:5607:5efe:85e2:a0ed:cd6:d7c0,TCP,74,443  >  1051 [ACK] Seq=6814 Ack=8673 Win=4194304 Len=0
162,3.874228,2620:1ec:42::132,2401:4900:5607:5efe:85e2:a0ed:cd6:d7c0,TCP,74,443  >  1051 [ACK] Seq=6814 Ack=10073 Win=4194304 Len=0
163,3.874914,2620:1ec:42::132,2401:4900:5607:5efe:85e2:a0ed:cd6:d7c0,TCP,74,443  >  1051 [ACK] Seq=6814 Ack=11473 Win=4194304 Len=0
164,3.881624,2620:1ec:42::132,2401:4900:5607:5efe:85e2:a0ed:cd6:d7c0,TCP,74,443  >  1051 [ACK] Seq=6814 Ack=12873 Win=4194304 Len=0
165,3.881624,2620:1ec:42::132,2401:4900:5607:5efe:85e2:a0ed:cd6:d7c0,TCP,74,443  >  1051 [ACK] Seq=6814 Ack=13503 Win=4193536 Len=0
166,3.889228,2620:1ec:42::132,2401:4900:5607:5efe:85e2:a0ed:cd6:d7c0,TCP,74,443  >  1051 [ACK] Seq=6814 Ack=14903 Win=4194304 Len=0
167,3.889228,2620:1ec:42::132,2401:4900:5607:5efe:85e2:a0ed:cd6:d7c0,TCP,74,443  >  1051 [ACK] Seq=6814 Ack=16303 Win=4194304 Len=0
168,3.890949,2620:1ec:42::132,2401:4900:5607:5efe:85e2:a0ed:cd6:d7c0,TCP,74,443  >  1051 [ACK] Seq=6814 Ack=17703 Win=4194304 Len=0
169,3.895723,2620:1ec:42::132,2401:4900:5607:5efe:85e2:a0ed:cd6:d7c0,TCP,74,443  >  1051 [ACK] Seq=6814 Ack=19103 Win=4194304 Len=0
170,3.906891,2620:1ec:42::132,2401:4900:5607:5efe:85e2:a0ed:cd6:d7c0,TCP,74,443  >  1051 [ACK] Seq=6814 Ack=20503 Win=4194304 Len=0
171,3.913621,2620:1ec:42::132,2401:4900:5607:5efe:85e2:a0ed:cd6:d7c0,TCP,74,443  >  1051 [ACK] Seq=6814 Ack=20970 Win=4193792 Len=0
172,3.941717,192.168.59.222,192.168.59.232,DNS,223,Standard query response 0x5298 A presence.teams.microsoft.com CNAME presence.services.sfb.trafficmanager.net CNAME a-ups-presence3-prod-azsc.japanwest.cloudapp.azure.com A 52.114.36.17
173,3.942551,192.168.59.222,192.168.59.232,DNS,267,Standard query response 0xb980 AAAA presence.teams.microsoft.com CNAME presence.services.sfb.trafficmanager.net CNAME a-ups-presence3-prod-azsc.japanwest.cloudapp.azure.com SOA ns1-01.azure-dns.com
174,3.942933,192.168.59.222,192.168.59.232,DNS,175,Standard query response 0x774d A trouter2-azsc-jpea-1-b.trouter.teams.microsoft.com CNAME trouter2-azsc-jpea-1-b.cloudapp.net A 52.114.32.217
175,3.943406,192.168.59.232,52.114.36.17,TCP,66,1056  >  443 [SYN] Seq=0 Win=64240 Len=0 MSS=1460 WS=256 SACK_PERM=1
176,3.943779,192.168.59.232,52.114.36.17,TCP,66,1057  >  443 [SYN] Seq=0 Win=64240 Len=0 MSS=1460 WS=256 SACK_PERM=1
177,3.946441,192.168.59.222,192.168.59.232,DNS,187,Standard query response 0x0f90 AAAA trouter2-azsc-jpea-1-b.trouter.teams.microsoft.com CNAME trouter2-azsc-jpea-1-b.cloudapp.net AAAA 2603:1040:401:5::3c
178,3.947269,2401:4900:5607:5efe:85e2:a0ed:cd6:d7c0,2603:1040:401:5::3c,TCP,86,1058  >  443 [SYN] Seq=0 Win=64800 Len=0 MSS=1440 WS=256 SACK_PERM=1
179,3.960487,2620:1ec:42::132,2401:4900:5607:5efe:85e2:a0ed:cd6:d7c0,TLSv1.2,404,Application Data
180,3.960487,2620:1ec:42::132,2401:4900:5607:5efe:85e2:a0ed:cd6:d7c0,TLSv1.2,169,Application Data
181,3.960487,2620:1ec:42::132,2401:4900:5607:5efe:85e2:a0ed:cd6:d7c0,TLSv1.2,112,Application Data
182,3.960531,2401:4900:5607:5efe:85e2:a0ed:cd6:d7c0,2620:1ec:42::132,TCP,74,1051  >  443 [ACK] Seq=20970 Ack=7277 Win=65792 Len=0
183,3.96622,162.159.136.234,192.168.59.232,TLSv1.2,163,Application Data
184,4.006182,192.168.59.232,20.42.73.25,TCP,54,"[TCP Retransmission] 1050  >  443 [FIN, ACK] Seq=22913 Ack=7614 Win=65792 Len=0"
185,4.01819,192.168.59.232,162.159.136.234,TCP,54,2247  >  443 [ACK] Seq=1 Ack=2189 Win=3574 Len=0
186,4.050396,2401:4900:5607:5efe:85e2:a0ed:cd6:d7c0,2603:1040:401:5::3c,TCP,86,1059  >  443 [SYN] Seq=0 Win=64800 Len=0 MSS=1440 WS=256 SACK_PERM=1
187,4.145123,20.42.73.25,192.168.59.232,TCP,54,"443  >  1050 [FIN, ACK] Seq=7614 Ack=22914 Win=524800 Len=0"
188,4.145241,192.168.59.232,20.42.73.25,TCP,54,1050  >  443 [ACK] Seq=22914 Ack=7615 Win=65792 Len=0
189,4.219832,2620:1ec:42::132,2401:4900:5607:5efe:85e2:a0ed:cd6:d7c0,TLSv1.2,280,Application Data
190,4.219832,2620:1ec:42::132,2401:4900:5607:5efe:85e2:a0ed:cd6:d7c0,TLSv1.2,660,Application Data
191,4.219832,2620:1ec:42::132,2401:4900:5607:5efe:85e2:a0ed:cd6:d7c0,TLSv1.2,569,Application Data
192,4.219832,2620:1ec:42::132,2401:4900:5607:5efe:85e2:a0ed:cd6:d7c0,TLSv1.2,457,Application Data
193,4.219832,2620:1ec:42::132,2401:4900:5607:5efe:85e2:a0ed:cd6:d7c0,TLSv1.2,271,Application Data
194,4.219832,2620:1ec:42::132,2401:4900:5607:5efe:85e2:a0ed:cd6:d7c0,TLSv1.2,474,Application Data
195,4.219832,2620:1ec:42::132,2401:4900:5607:5efe:85e2:a0ed:cd6:d7c0,TLSv1.2,212,Application Data
196,4.219832,2620:1ec:42::132,2401:4900:5607:5efe:85e2:a0ed:cd6:d7c0,TLSv1.2,263,Application Data
197,4.219832,2620:1ec:42::132,2401:4900:5607:5efe:85e2:a0ed:cd6:d7c0,TLSv1.2,555,Application Data
198,4.219906,2401:4900:5607:5efe:85e2:a0ed:cd6:d7c0,2620:1ec:42::132,TCP,74,1051  >  443 [ACK] Seq=20970 Ack=10352 Win=65792 Len=0
199,4.221718,2620:1ec:42::132,2401:4900:5607:5efe:85e2:a0ed:cd6:d7c0,TLSv1.2,448,Application Data
200,4.221718,2620:1ec:42::132,2401:4900:5607:5efe:85e2:a0ed:cd6:d7c0,TLSv1.2,301,Application Data
201,4.221718,2620:1ec:42::132,2401:4900:5607:5efe:85e2:a0ed:cd6:d7c0,TLSv1.2,194,Application Data
202,4.221718,2620:1ec:42::132,2401:4900:5607:5efe:85e2:a0ed:cd6:d7c0,TLSv1.2,205,Application Data
203,4.221718,2620:1ec:42::132,2401:4900:5607:5efe:85e2:a0ed:cd6:d7c0,TLSv1.2,182,Application Data
204,4.221718,2620:1ec:42::132,2401:4900:5607:5efe:85e2:a0ed:cd6:d7c0,TLSv1.2,411,Application Data
205,4.221718,2620:1ec:42::132,2401:4900:5607:5efe:85e2:a0ed:cd6:d7c0,TLSv1.2,122,Application Data
206,4.221718,2620:1ec:42::132,2401:4900:5607:5efe:85e2:a0ed:cd6:d7c0,TLSv1.2,112,Application Data
207,4.221755,2401:4900:5607:5efe:85e2:a0ed:cd6:d7c0,2620:1ec:42::132,TCP,74,1051  >  443 [ACK] Seq=20970 Ack=11735 Win=64256 Len=0
208,4.25864,192.168.59.232,52.114.32.217,TCP,66,1060  >  443 [SYN] Seq=0 Win=64240 Len=0 MSS=1460 WS=256 SACK_PERM=1
209,4.291322,192.168.59.232,192.168.59.222,DNS,89,Standard query 0x51a5 A in.ng.msg.teams.microsoft.com
210,4.291761,192.168.59.232,192.168.59.222,DNS,89,Standard query 0x83c2 AAAA in.ng.msg.teams.microsoft.com
211,4.300128,2603:1040:401:5::3c,2401:4900:5607:5efe:85e2:a0ed:cd6:d7c0,TCP,86,"443  >  1059 [SYN, ACK] Seq=0 Ack=1 Win=65535 Len=0 MSS=1400 WS=256 SACK_PERM=1"
212,4.300194,2401:4900:5607:5efe:85e2:a0ed:cd6:d7c0,2603:1040:401:5::3c,TCP,74,1059  >  443 [ACK] Seq=1 Ack=1 Win=64768 Len=0
213,4.300723,2401:4900:5607:5efe:85e2:a0ed:cd6:d7c0,2603:1040:401:5::3c,TLSv1.2,591,Client Hello
214,4.311783,2603:1040:401:5::3c,2401:4900:5607:5efe:85e2:a0ed:cd6:d7c0,TCP,86,"443  >  1058 [SYN, ACK] Seq=0 Ack=1 Win=65535 Len=0 MSS=1400 WS=256 SACK_PERM=1"
215,4.311783,52.114.36.17,192.168.59.232,TCP,66,"443  >  1057 [SYN, ACK] Seq=0 Ack=1 Win=65535 Len=0 MSS=1400 WS=256 SACK_PERM=1"
216,4.311843,2401:4900:5607:5efe:85e2:a0ed:cd6:d7c0,2603:1040:401:5::3c,TCP,74,1058  >  443 [ACK] Seq=1 Ack=1 Win=64768 Len=0
217,4.31194,192.168.59.232,52.114.36.17,TCP,54,1057  >  443 [ACK] Seq=1 Ack=1 Win=65792 Len=0
218,4.311991,52.114.36.17,192.168.59.232,TCP,66,"443  >  1056 [SYN, ACK] Seq=0 Ack=1 Win=65535 Len=0 MSS=1400 WS=256 SACK_PERM=1"
219,4.312011,192.168.59.232,52.114.36.17,TCP,54,1056  >  443 [ACK] Seq=1 Ack=1 Win=65792 Len=0
220,4.312411,2401:4900:5607:5efe:85e2:a0ed:cd6:d7c0,2603:1040:401:5::3c,TLSv1.2,591,Client Hello
221,4.312657,192.168.59.232,52.114.36.17,TLSv1.2,571,Client Hello
222,4.312859,192.168.59.232,52.114.36.17,TLSv1.2,571,Client Hello
223,4.385981,20.42.73.25,192.168.59.232,TCP,54,[TCP Dup ACK 187#1] 443  >  1050 [ACK] Seq=7615 Ack=22914 Win=524800 Len=0
224,4.445314,162.159.136.234,192.168.59.232,TLSv1.2,247,Application Data
225,4.463684,162.159.136.234,192.168.59.232,TLSv1.2,99,Application Data
226,4.463723,192.168.59.232,162.159.136.234,TCP,54,2247  >  443 [ACK] Seq=1 Ack=2427 Win=3573 Len=0
227,4.485285,2603:1040:401:5::3c,2401:4900:5607:5efe:85e2:a0ed:cd6:d7c0,TCP,1474,443  >  1059 [ACK] Seq=1 Ack=518 Win=524288 Len=1400 [TCP segment of a reassembled PDU]
228,4.487388,2603:1040:401:5::3c,2401:4900:5607:5efe:85e2:a0ed:cd6:d7c0,TCP,1474,443  >  1059 [ACK] Seq=1401 Ack=518 Win=524288 Len=1400 [TCP segment of a reassembled PDU]
229,4.487422,2401:4900:5607:5efe:85e2:a0ed:cd6:d7c0,2603:1040:401:5::3c,TCP,74,1059  >  443 [ACK] Seq=518 Ack=2801 Win=65792 Len=0
230,4.48748,2603:1040:401:5::3c,2401:4900:5607:5efe:85e2:a0ed:cd6:d7c0,TCP,1474,443  >  1059 [ACK] Seq=2801 Ack=518 Win=524288 Len=1400 [TCP segment of a reassembled PDU]
231,4.491207,2603:1040:401:5::3c,2401:4900:5607:5efe:85e2:a0ed:cd6:d7c0,TCP,1474,443  >  1059 [ACK] Seq=4201 Ack=518 Win=524288 Len=1400 [TCP segment of a reassembled PDU]
232,4.491247,2401:4900:5607:5efe:85e2:a0ed:cd6:d7c0,2603:1040:401:5::3c,TCP,74,1059  >  443 [ACK] Seq=518 Ack=5601 Win=65792 Len=0
233,4.491421,2603:1040:401:5::3c,2401:4900:5607:5efe:85e2:a0ed:cd6:d7c0,TLSv1.2,163,"Server Hello, Certificate, Certificate Status, Server Key Exchange, Server Hello Done"
234,4.494811,2603:1040:401:5::3c,2401:4900:5607:5efe:85e2:a0ed:cd6:d7c0,TCP,5674,443  >  1058 [ACK] Seq=1 Ack=518 Win=524288 Len=5600 [TCP segment of a reassembled PDU]
235,4.494848,2401:4900:5607:5efe:85e2:a0ed:cd6:d7c0,2603:1040:401:5::3c,TCP,74,1058  >  443 [ACK] Seq=518 Ack=5601 Win=65792 Len=0
236,4.494948,2603:1040:401:5::3c,2401:4900:5607:5efe:85e2:a0ed:cd6:d7c0,TLSv1.2,163,"Server Hello, Certificate, Certificate Status, Server Key Exchange, Server Hello Done"
237,4.495281,2401:4900:5607:5efe:85e2:a0ed:cd6:d7c0,2603:1040:401:5::3c,TLSv1.2,232,"Client Key Exchange, Change Cipher Spec, Encrypted Handshake Message"
238,4.496654,2401:4900:5607:5efe:85e2:a0ed:cd6:d7c0,2603:1040:401:5::3c,TLSv1.2,232,"Client Key Exchange, Change Cipher Spec, Encrypted Handshake Message"
239,4.523739,192.168.59.222,192.168.59.232,DNS,207,Standard query response 0x51a5 A in.ng.msg.teams.microsoft.com CNAME in.ng.msg.teams-msgapi.trafficmanager.net CNAME msgapi-prod-wjp-azsc6-1.cloudapp.net A 52.114.36.125
240,4.523888,192.168.59.222,192.168.59.232,DNS,252,Standard query response 0x83c2 AAAA in.ng.msg.teams.microsoft.com CNAME in.ng.msg.teams-msgapi.trafficmanager.net CNAME msgapi-prod-wjp-azsc6-1.cloudapp.net SOA ns1-201.azure-dns.com
241,4.524963,192.168.59.232,52.114.36.125,TCP,66,1061  >  443 [SYN] Seq=0 Win=64240 Len=0 MSS=1460 WS=256 SACK_PERM=1
242,4.554663,192.168.59.232,52.114.36.125,TCP,66,1062  >  443 [SYN] Seq=0 Win=64240 Len=0 MSS=1460 WS=256 SACK_PERM=1
243,4.628305,52.114.32.217,192.168.59.232,TCP,66,"443  >  1060 [SYN, ACK] Seq=0 Ack=1 Win=65535 Len=0 MSS=1400 WS=256 SACK_PERM=1"
244,4.645301,2603:1040:401:5::3c,2401:4900:5607:5efe:85e2:a0ed:cd6:d7c0,TLSv1.2,125,"Change Cipher Spec, Encrypted Handshake Message"
245,4.64588,2401:4900:5607:5efe:85e2:a0ed:cd6:d7c0,2603:1040:401:5::3c,TCP,1474,1059  >  443 [ACK] Seq=676 Ack=5741 Win=65536 Len=1400 [TCP segment of a reassembled PDU]
246,4.64588,2401:4900:5607:5efe:85e2:a0ed:cd6:d7c0,2603:1040:401:5::3c,TLSv1.2,399,Application Data
247,4.66227,52.114.36.17,192.168.59.232,TCP,5654,443  >  1056 [ACK] Seq=1 Ack=518 Win=4193792 Len=5600 [TCP segment of a reassembled PDU]
248,4.66227,2603:1040:401:5::3c,2401:4900:5607:5efe:85e2:a0ed:cd6:d7c0,TLSv1.2,125,"Change Cipher Spec, Encrypted Handshake Message"
249,4.66227,52.114.36.17,192.168.59.232,TLSv1.2,704,"Server Hello, Certificate, Certificate Status, Server Key Exchange, Server Hello Done"
250,4.66227,52.114.36.17,192.168.59.232,TCP,5654,443  >  1057 [ACK] Seq=1 Ack=518 Win=4193792 Len=5600 [TCP segment of a reassembled PDU]
251,4.662328,192.168.59.232,52.114.36.17,TCP,54,1056  >  443 [ACK] Seq=518 Ack=6251 Win=65792 Len=0
252,4.662358,192.168.59.232,52.114.36.17,TCP,54,1057  >  443 [ACK] Seq=518 Ack=5601 Win=65792 Len=0
253,4.662604,52.114.36.17,192.168.59.232,TLSv1.2,704,"Server Hello, Certificate, Certificate Status, Server Key Exchange, Server Hello Done"
254,4.667172,192.168.59.232,52.114.36.17,TLSv1.2,212,"Client Key Exchange, Change Cipher Spec, Encrypted Handshake Message"
255,4.668616,192.168.59.232,52.114.36.17,TLSv1.2,212,"Client Key Exchange, Change Cipher Spec, Encrypted Handshake Message"
256,4.668734,192.168.59.232,52.114.36.17,TCP,54,"1057  >  443 [FIN, ACK] Seq=676 Ack=6251 Win=65024 Len=0"
257,4.668836,192.168.59.232,52.114.36.17,TLSv1.2,153,Application Data
258,4.66904,192.168.59.232,52.114.36.17,TCP,1454,1056  >  443 [ACK] Seq=775 Ack=6251 Win=65792 Len=1400 [TCP segment of a reassembled PDU]
259,4.66904,192.168.59.232,52.114.36.17,TLSv1.2,879,Application Data
260,4.669129,192.168.59.232,52.114.36.17,TLSv1.2,252,Application Data
261,4.707324,2401:4900:5607:5efe:85e2:a0ed:cd6:d7c0,2603:1040:401:5::3c,TCP,74,1058  >  443 [ACK] Seq=676 Ack=5741 Win=65536 Len=0
262,4.805109,2603:1040:401:5::3c,2401:4900:5607:5efe:85e2:a0ed:cd6:d7c0,TCP,74,443  >  1059 [ACK] Seq=5741 Ack=2401 Win=524800 Len=0
263,4.806934,2603:1040:401:5::3c,2401:4900:5607:5efe:85e2:a0ed:cd6:d7c0,TLSv1.2,934,Application Data
264,4.813263,2401:4900:5607:5efe:85e2:a0ed:cd6:d7c0,2603:1040:401:5::3c,TLSv1.2,1249,Application Data
265,4.822827,52.114.36.17,192.168.59.232,TCP,66,[TCP Dup ACK 247#1] 443  >  1056 [ACK] Seq=6251 Ack=518 Win=4193792 Len=0 SLE=676 SRE=775
266,4.822827,52.114.36.17,192.168.59.232,TCP,54,443  >  1056 [ACK] Seq=6251 Ack=775 Win=4193536 Len=0
267,4.826203,52.114.36.17,192.168.59.232,TLSv1.2,105,"Change Cipher Spec, Encrypted Handshake Message"
268,4.826294,52.114.36.17,192.168.59.232,TLSv1.2,123,Application Data
269,4.826306,192.168.59.232,52.114.36.17,TCP,54,1056  >  443 [ACK] Seq=3198 Ack=6371 Win=65536 Len=0
270,4.826591,192.168.59.232,52.114.36.17,TLSv1.2,92,Application Data
271,4.83221,52.114.36.17,192.168.59.232,TLSv1.2,92,Application Data
272,4.886039,192.168.59.232,52.114.36.17,TCP,54,1056  >  443 [ACK] Seq=3236 Ack=6409 Win=65536 Len=0
273,4.886063,52.114.36.125,192.168.59.232,TCP,66,"443  >  1061 [SYN, ACK] Seq=0 Ack=1 Win=65535 Len=0 MSS=1400 WS=256 SACK_PERM=1"
274,4.886063,52.114.36.125,192.168.59.232,TCP,66,"443  >  1062 [SYN, ACK] Seq=0 Ack=1 Win=65535 Len=0 MSS=1400 WS=256 SACK_PERM=1"
275,4.886196,192.168.59.232,52.114.36.125,TCP,54,1061  >  443 [ACK] Seq=1 Ack=1 Win=65792 Len=0
276,4.886233,192.168.59.232,52.114.36.125,TCP,54,1062  >  443 [ACK] Seq=1 Ack=1 Win=65792 Len=0
277,4.886647,192.168.59.232,52.114.36.125,TLSv1.2,571,Client Hello
278,4.886932,192.168.59.232,52.114.36.125,TLSv1.2,571,Client Hello
279,4.893103,52.114.36.17,192.168.59.232,TCP,54,443  >  1057 [ACK] Seq=6251 Ack=677 Win=4193536 Len=0
280,4.898396,52.114.36.17,192.168.59.232,TLSv1.2,105,"Change Cipher Spec, Encrypted Handshake Message"
281,4.898437,192.168.59.232,52.114.36.17,TCP,54,"1057  >  443 [RST, ACK] Seq=677 Ack=6302 Win=0 Len=0"
282,4.900518,52.114.36.17,192.168.59.232,TLSv1.2,123,Application Data
283,4.904056,52.114.36.17,192.168.59.232,TCP,54,"443  >  1057 [RST, ACK] Seq=6371 Ack=677 Win=0 Len=0"
284,4.970667,2603:1040:401:5::3c,2401:4900:5607:5efe:85e2:a0ed:cd6:d7c0,TLSv1.2,661,Application Data
285,4.97083,2603:1040:401:5::3c,2401:4900:5607:5efe:85e2:a0ed:cd6:d7c0,TLSv1.2,108,Application Data
286,4.970844,2401:4900:5607:5efe:85e2:a0ed:cd6:d7c0,2603:1040:401:5::3c,TCP,74,1059  >  443 [ACK] Seq=3576 Ack=7222 Win=65792 Len=0
287,4.975829,2401:4900:5607:5efe:85e2:a0ed:cd6:d7c0,2603:1040:401:5::3c,TCP,86,1063  >  443 [SYN] Seq=0 Win=64800 Len=0 MSS=1440 WS=256 SACK_PERM=1
288,4.982572,52.114.36.17,192.168.59.232,TCP,54,443  >  1056 [ACK] Seq=6409 Ack=3236 Win=4193280 Len=0
289,4.982572,52.114.36.17,192.168.59.232,TLSv1.2,307,Application Data
290,4.998712,192.168.59.232,52.114.36.17,TLSv1.2,176,Application Data
291,4.998914,192.168.59.232,52.114.36.17,TLSv1.2,242,Application Data
292,4.999162,192.168.59.232,52.114.36.17,TLSv1.2,166,Application Data
293,4.9992,192.168.59.232,52.114.36.17,TLSv1.2,242,Application Data
294,5.178466,52.114.36.17,192.168.59.232,TCP,54,443  >  1056 [ACK] Seq=6662 Ack=3846 Win=4194304 Len=0
295,5.20123,52.114.36.17,192.168.59.232,TLSv1.2,163,Application Data
296,5.238156,2603:1040:401:5::3c,2401:4900:5607:5efe:85e2:a0ed:cd6:d7c0,TCP,86,"443  >  1063 [SYN, ACK] Seq=0 Ack=1 Win=65535 Len=0 MSS=1400 WS=256 SACK_PERM=1"
297,5.238322,2401:4900:5607:5efe:85e2:a0ed:cd6:d7c0,2603:1040:401:5::3c,TCP,74,1063  >  443 [ACK] Seq=1 Ack=1 Win=64768 Len=0
298,5.238916,2401:4900:5607:5efe:85e2:a0ed:cd6:d7c0,2603:1040:401:5::3c,TLSv1.2,591,Client Hello
299,5.249507,192.168.59.232,52.114.36.17,TCP,54,1056  >  443 [ACK] Seq=3846 Ack=6771 Win=65280 Len=0
300,5.258046,52.114.36.125,192.168.59.232,TCP,1454,443  >  1061 [ACK] Seq=1 Ack=518 Win=524288 Len=1400 [TCP segment of a reassembled PDU]
301,5.258122,52.114.36.125,192.168.59.232,TCP,1454,443  >  1061 [ACK] Seq=1401 Ack=518 Win=524288 Len=1400 [TCP segment of a reassembled PDU]
302,5.25814,192.168.59.232,52.114.36.125,TCP,54,1061  >  443 [ACK] Seq=518 Ack=2801 Win=65792 Len=0
303,5.272677,52.114.36.125,192.168.59.232,TCP,2854,443  >  1061 [ACK] Seq=2801 Ack=518 Win=524288 Len=2800 [TCP segment of a reassembled PDU]
304,5.272677,52.114.36.125,192.168.59.232,TCP,5654,443  >  1062 [ACK] Seq=1 Ack=518 Win=524288 Len=5600 [TCP segment of a reassembled PDU]
305,5.272677,52.114.36.125,192.168.59.232,TLSv1.2,587,"Server Hello, Certificate, Certificate Status, Server Key Exchange, Server Hello Done"
306,5.272677,52.114.36.125,192.168.59.232,TLSv1.2,587,"Server Hello, Certificate, Certificate Status, Server Key Exchange, Server Hello Done"
307,5.272732,192.168.59.232,52.114.36.125,TCP,54,1061  >  443 [ACK] Seq=518 Ack=6134 Win=65792 Len=0
308,5.272762,192.168.59.232,52.114.36.125,TCP,54,1062  >  443 [ACK] Seq=518 Ack=6134 Win=65792 Len=0
309,5.278273,192.168.59.232,52.114.36.125,TLSv1.2,212,"Client Key Exchange, Change Cipher Spec, Encrypted Handshake Message"
310,5.279719,192.168.59.232,52.114.36.125,TLSv1.2,212,"Client Key Exchange, Change Cipher Spec, Encrypted Handshake Message"
311,5.279822,192.168.59.232,52.114.36.125,TCP,54,"1061  >  443 [FIN, ACK] Seq=676 Ack=6134 Win=65792 Len=0"
312,5.279949,192.168.59.232,52.114.36.125,TLSv1.2,153,Application Data
313,5.280135,192.168.59.232,52.114.36.125,TCP,1454,1062  >  443 [ACK] Seq=775 Ack=6134 Win=65792 Len=1400 [TCP segment of a reassembled PDU]
314,5.280135,192.168.59.232,52.114.36.125,TLSv1.2,69,Application Data
315,5.444552,52.114.36.125,192.168.59.232,TCP,54,443  >  1062 [ACK] Seq=6134 Ack=676 Win=524288 Len=0
316,5.447328,52.114.36.125,192.168.59.232,TLSv1.2,105,"Change Cipher Spec, Encrypted Handshake Message"
317,5.455169,52.114.36.125,192.168.59.232,TLSv1.2,190,"Application Data, Application Data, Application Data"
318,5.45521,192.168.59.232,52.114.36.125,TCP,54,1062  >  443 [ACK] Seq=2190 Ack=6321 Win=65536 Len=0
319,5.455716,192.168.59.232,52.114.36.125,TLSv1.2,92,Application Data
320,5.460114,52.114.36.125,192.168.59.232,TCP,66,[TCP Dup ACK 317#1] 443  >  1062 [ACK] Seq=6321 Ack=775 Win=524032 Len=0 SLE=2175 SRE=2190
321,5.460114,52.114.36.125,192.168.59.232,TCP,54,443  >  1062 [ACK] Seq=6321 Ack=2190 Win=524800 Len=0
322,5.614836,2603:1040:401:5::3c,2401:4900:5607:5efe:85e2:a0ed:cd6:d7c0,TCP,5674,443  >  1063 [ACK] Seq=1 Ack=518 Win=524288 Len=5600 [TCP segment of a reassembled PDU]
323,5.615042,2401:4900:5607:5efe:85e2:a0ed:cd6:d7c0,2603:1040:401:5::3c,TCP,74,1063  >  443 [ACK] Seq=518 Ack=5601 Win=65792 Len=0
324,5.615247,2603:1040:401:5::3c,2401:4900:5607:5efe:85e2:a0ed:cd6:d7c0,TLSv1.2,163,"Server Hello, Certificate, Certificate Status, Server Key Exchange, Server Hello Done"
325,5.616867,52.114.36.125,192.168.59.232,TCP,54,[TCP Dup ACK 300#1] 443  >  1061 [ACK] Seq=6134 Ack=518 Win=524288 Len=0
326,5.616867,52.114.36.125,192.168.59.232,TCP,54,443  >  1061 [ACK] Seq=6134 Ack=677 Win=524288 Len=0
327,5.617032,2401:4900:5607:5efe:85e2:a0ed:cd6:d7c0,2603:1040:401:5::3c,TLSv1.2,232,"Client Key Exchange, Change Cipher Spec, Encrypted Handshake Message"
328,5.617288,52.114.36.125,192.168.59.232,TCP,54,443  >  1062 [ACK] Seq=6321 Ack=2228 Win=524800 Len=0
329,5.621178,52.114.36.125,192.168.59.232,TCP,54,"443  >  1061 [FIN, ACK] Seq=6134 Ack=677 Win=524288 Len=0"
330,5.621206,192.168.59.232,52.114.36.125,TCP,54,1061  >  443 [ACK] Seq=677 Ack=6135 Win=65792 Len=0
331,5.661796,52.114.36.125,192.168.59.232,TLSv1.2,528,Application Data
332,5.667662,52.114.36.125,192.168.59.232,TCP,2854,443  >  1062 [ACK] Seq=6795 Ack=2228 Win=524800 Len=2800 [TCP segment of a reassembled PDU]
333,5.667662,52.114.36.125,192.168.59.232,TLSv1.2,1379,Application Data
334,5.667662,52.114.36.125,192.168.59.232,TLSv1.2,4254,"Application Data, Application Data"
335,5.66771,192.168.59.232,52.114.36.125,TCP,54,1062  >  443 [ACK] Seq=2228 Ack=15120 Win=65792 Len=0
336,5.678614,52.114.36.125,192.168.59.232,TCP,1454,443  >  1062 [ACK] Seq=15120 Ack=2228 Win=524800 Len=1400 [TCP segment of a reassembled PDU]
337,5.678614,52.114.36.125,192.168.59.232,TLSv1.2,1091,Application Data
338,5.678614,52.114.36.125,192.168.59.232,TLSv1.2,92,Application Data
339,5.678698,192.168.59.232,52.114.36.125,TCP,54,1062  >  443 [ACK] Seq=2228 Ack=17595 Win=65792 Len=0
340,5.725202,192.168.59.232,52.114.36.17,TLSv1.2,214,Application Data
341,5.72539,192.168.59.232,52.114.36.17,TLSv1.2,148,Application Data
